{
  "$schema": "https://json-schema.org/draft/2020-12/schema",
  "$id": "PlaywrightAutomationHandoff@2",
  "type": "object",
  "required": [
    "schema",
    "feature_id",
    "run_id",
    "status",
    "intent_id",
    "source_refs",
    "run_command",
    "acceptance_command",
    "run_exit_code",
    "results",
    "platform_records",
    "quality_gates",
    "unresolved_blockers",
    "next_actions",
    "excluded_cases"
  ],
  "additionalProperties": false,
  "allOf": [
    {
      "if": { "properties": { "status": { "const": "passed" } }, "required": ["status"] },
      "then": { "properties": { "platform_records": { "type": "array", "minItems": 1 } } }
    }
  ],
  "properties": {
    "schema": { "type": "string", "const": "PlaywrightAutomationHandoff@2" },
    "feature_id": { "type": "string", "pattern": "^\\d{4}-\\d{2}-[a-z0-9]+(?:-[a-z0-9]+)*$" },
    "run_id": { "type": "string", "pattern": "^\\d{8}-\\d{4}-[a-z0-9]{8}$" },
    "status": {
      "type": "string",
      "enum": ["passed", "partial", "blocked_by_product", "blocked_by_env", "failed"]
    },
    "intent_id": { "type": "string", "pattern": "^SR-INTENT-[A-Z0-9-]+$" },
    "source_refs": {
      "type": "object",
      "required": ["intent", "env", "probe", "self_run"],
      "additionalProperties": false,
      "properties": {
        "intent": { "type": "string" },
        "env": { "type": "string" },
        "probe": { "type": "string" },
        "self_run": { "type": "string" }
      }
    },
    "run_command": { "type": "string" },
    "acceptance_command": {
      "type": "string",
      "allOf": [{ "pattern": "full\\.spec\\.ts" }, { "pattern": "--headed" }]
    },
    "run_exit_code": { "type": "integer", "minimum": 0 },
    "results": {
      "type": "object",
      "required": ["total", "passed", "failed", "skipped", "report_paths"],
      "additionalProperties": false,
      "properties": {
        "total": { "type": "integer", "minimum": 0 },
        "passed": { "type": "integer", "minimum": 0 },
        "failed": { "type": "integer", "minimum": 0 },
        "skipped": { "type": "integer", "minimum": 0 },
        "report_paths": {
          "type": "object",
          "additionalProperties": false,
          "properties": {
            "playwright_json": { "type": "string" },
            "allure": { "type": "string" },
            "stdout": { "type": "string" }
          }
        }
      }
    },
    "platform_records": {
      "type": "array",
      "items": {
        "type": "object",
        "required": ["case_id", "record_type", "record_name", "evidence_path"],
        "additionalProperties": false,
        "properties": {
          "case_id": { "type": "string", "minLength": 1 },
          "record_type": { "type": "string", "minLength": 1 },
          "record_name": { "type": "string", "minLength": 1 },
          "record_id": { "type": "string" },
          "status": { "type": "string" },
          "route": { "type": "string" },
          "api": { "type": "string" },
          "evidence_path": { "type": "string", "minLength": 1 }
        }
      }
    },
    "quality_gates": {
      "type": "array",
      "items": {
        "type": "object",
        "required": ["name", "status"],
        "additionalProperties": false,
        "properties": {
          "name": { "type": "string" },
          "status": { "type": "string", "enum": ["passed", "failed", "skipped"] },
          "detail": { "type": "string" }
        }
      }
    },
    "unresolved_blockers": {
      "type": "array",
      "items": {
        "type": "object",
        "required": ["kind"],
        "additionalProperties": false,
        "properties": {
          "kind": {
            "type": "string",
            "enum": ["product", "script", "data", "permission", "environment", "unknown"]
          },
          "case": { "type": "string" },
          "evidence_path": { "type": "string" }
        }
      }
    },
    "next_actions": { "type": "array", "items": { "type": "string" } },
    "excluded_cases": {
      "type": "array",
      "items": {
        "type": "object",
        "required": ["case_id", "reason_category"],
        "additionalProperties": false,
        "properties": {
          "case_id": { "type": "string", "minLength": 1 },
          "reason_category": {
            "type": "string",
            "enum": ["env", "data_prep", "external_system", "tenant_mismatch", "ui_missing"]
          },
          "evidence_path": { "type": "string" },
          "detail": { "type": "string" }
        }
      }
    }
  }
}
